title,author,year,journal,abstract,research_areas,label,screened_abstracts,notes
Contrasting effects of Symbiodinium identity on coral host transcriptional profiles across latitudes,"Barfield, Sarah J. and Aglyamova, Galina V. and Bay, Line K. and Matz, Mikhail V.",2018,Molecular Ecology,"Reef-building corals can increase their resistance to heat-induced bleaching through adaptation and acclimatization and/or by associating with a more thermo-tolerant strain of algal symbiont (Symbiodinium sp.). Here, we show that these two adaptive pathways interact. We collected Acropora millepora corals from two contrasting thermal environments on the Great Barrier Reef: cooler, mid-latitude Orpheus Island, where all corals hosted a heat-sensitive clade C Symbiodinium, and warmer, low-latitude Wilkie Island, where corals hosted either a clade C or a more thermo-tolerant clade D. Corals were kept in a benign common garden to reveal differences in baseline gene expression, reflecting prior adaptation/long-term acclimatization. Model-based analysis identified gene expression differences between Wilkie and Orpheus corals that were negatively correlated with previously described transcriptome-wide signatures of heat stress, signifying generally elevated thermotolerance of Wilkie corals. Yet, model-free analyses of gene expression revealed that Wilkie corals hosting clade C were distinct from Wilkie corals hosting clade D, whereas Orpheus corals were more variable. Wilkie corals hosting clade C symbionts exhibited unique functional signatures, including downregulation of histone proteins and ion channels and upregulation of chaperones and RNA processing genes, putatively representing constitutive frontloading of stress response genes. Furthermore, clade C Symbiodinium exhibited constitutive expression differences between Wilkie and Orpheus, indicative of contrasting life history strategies. Our results demonstrate that hosting alternative Symbiodinium types is associated with different pathways of local adaptation for the coral host. These interactions could play a significant role in setting the direction of genetic adaptation to global warming in the two symbiotic partners.",Biochemistry \& Molecular Biology; Environmental Sciences \& Ecology; Evolutionary Biology,2018.828,excluded,
"Coral microbiome dynamics, functions and design in a changing world","van Oppen, Madeleine J. H. and Blackall, Linda L.",2019,Nature Reviews Microbiology,"Corals associate not only with dinoflagellates, which are their algal endosymbionts and which have been extensively studied over the past four decades, but also with a variety of other microorganisms. The coral microbiome includes dinoflagellates, viruses, fungi, archaea and bacteria, with knowledge of the latter growing rapidly. This Review focuses on the bacterial members of the coral microbiome and draws parallels with better-studied microbiomes in other biological systems. We synthesize current understanding of spatial, temporal and host-specific patterns in coral-associated bacterial communities, the drivers shaping these patterns, and the role of the microbiome in acclimatization and adaptation of the host to climate warming. We discuss how this knowledge can be harnessed to assist the future persistence of coral reefs and provide novel perspectives for the development of microbiome engineering and its implications for coral reef conservation and restoration.",Microbiology,2019.8907,selected,
Climate change and coconut plantations in India: Impacts and potential adaptation gains,"Kumar, S. Naresh and Aggarwal, P. K.",2013,Agricultural Systems,"The assessment of impact of climate change on coconut, a plantation crop, is challenging. However, the development of a simulation model (InfoCrop-COCONUT) has enabled the process. We present the first simulation analysis of the potential impacts of climate change on coconut productivity in India following two approaches, namely: (i) `fixed increase in temperature and CO2, and (ii) scenarios as per PRECIS (Providing Regional Climates for Impact Studies) - a regional climate model. Impact of changed management on coconut productivity in current as well as in future climates is also assessed. Climate change is projected to increase coconut productivity in western coastal region, Kerala, parts of Tamil Nadu, Karnataka and Maharashtra (provided current level of water and management is made available in future climates as well) and also in North-Eastern states, islands of Andaman and Nicobar and Lakshadweep while negative impacts are projected for Andhra Pradesh, Orissa, West Bengal, Gujarat and parts of Karnataka and Tamil Nadu. On all India basis, even with current management, climate change is projected to increase coconut productivity by 4.3\% in A1B 2030, 1.9\% in A1B 2080, 6.8\% in A2 2080 and 5.7\% in 82 2080 scenarios of PRECIS over mean productivity of 2000-2005 period. Agronomic adaptations like soil moisture conservation, summer irrigation, drip irrigation, and fertilizer application cannot only minimize losses in majority of coconut growing regions, but also improve productivity substantially. Further, genetic adaptation measures like growing improved local Tall cultivars and hybrids under improved crop management is needed for long-term adaptation of plantation to climate change, particularly in regions that are projected to be negatively impacted by climate change. Such strategy can increase the productivity by about 33\% in 2030, and by 25-32\% in 2080 climate scenarios. In fact, productivity can be improved by 20\% to almost double if all plantations in India are provided with above mentioned management even in current climates. In places where positive impacts are projected, current poor management may become a limiting factor in reaping the benefits of CO2 fertilization, while in negatively affected regions adaptation strategies can reduce the impacts. Thus, intensive genetic and agronomic adaptation to climate change can substantially benefit the coconut production in India. (C) 2013 Elsevier Ltd. All rights reserved.",Agriculture,2013.288,excluded,
Climate change and the evolution of reef fishes: past and future,"Rummer, Jodie L. and Munday, Philip L.",2017,Fish And Fisheries,"Predicting the impacts of ocean warming and acidification on marine ecosystems requires an evolutionary perspective because, for most marine species, these environmental changes will occur over a number of generations. Acclimation through phenotypic plasticity and adaptation through genetic selection could help populations of some species cope with future warmer and more acidic oceans. Coral reef species are predicted to be some of the most vulnerable to climate change because they live close to their thermal limits. Yet, their evolutionary history may indicate that they possess adaptations that enable them to cope with a high CO2 environment. Here, we first explore the evolutionary history of reef fishes and how their history has shaped their physiological adaptations to environmental temperatures and pCO(2). We examine current-day thermal and CO2 environments experienced by coral reef fishes and summarize experimental studies that have tested how they respond to elevated temperatures and pCO(2) levels. We then examine evidence for acclimation and adaptation to projected ocean warming and acidification. Indeed, new studies have demonstrated the potential for transgenerational plasticity and heritable genetic variation that would allow some fishes to maintain performance as the oceans warm and become more acidic. We conclude by outlining management approaches - specifically those that can help preserve genetic variation by maintaining population size - to enhance the potential for genetic adaptation to climate change.",Fisheries,2017.10594,selected,
Climate change impacts on Australia's eucalypt and coral species: Comparing and sharing knowledge across disciplines,"Booth, Trevor H. and Muir, Paul R.",2020,Wiley Interdisciplinary Reviews-climate Change,"Two of Australia's most iconic ecosystems have recently sustained heavy damage related to climatic changes: the extensive eucalypt forests from catastrophic bushfires and the Great Barrier Reef from mass coral bleaching. Despite obvious differences, eucalypt trees and reef corals share some similarities in biology and ecology, particularly in relation to climate change impacts and adaptation. Both groups are the focus of an increasing research effort to characterize and respond to climate changes and here we examine how sharing research experiences can benefit both fields. Four key areas of research are considered: (a) modeling current distributions, (b) assessing impacts of climate change on future distributions, (c) using human-assisted migration to improve survival, and (d) applying genetic enhancement to improve the species' survival. Examples of each research area are used to examine potential crossovers, limitations of the methods, and future requirements. We conclude that eucalypt and coral researchers, and indeed researchers for many other endangered taxa, can gain much by comparing experiences and methods, despite the apparent differences in their respective taxa. This article is categorized under: Assessing Impacts of Climate Change > Observed Impacts of Climate Change",Environmental Sciences \& Ecology; Meteorology \& Atmospheric Sciences,2020.5582,selected,
