"title","author","year","journal","abstract","research_areas","label","screened_abstracts","notes"
"Reviews of power supply and environmental energy conversions for artificial upwelling","Zhang, Dahai and Fan, Wei and Yang, Jing and Pan, Yiwen and Chen, Ying and Huang, Haocai and Chen, Jiawang","2016","Renewable \& Sustainable Energy Reviews","Wave energy is being increasingly regarded as a major and promising resource since the artificial upwelling was invented. There are many different ways to convert wave energy to electricity and some other energy such as the power supply for artificial upwelling in this paper. An overview of wave energy converters in artificial upwelling application as well as the power systems and environmental energy conversions for the artificial upwelling all over the world is given in this article. Some basic principles are present, assessment and advices are shown for each category. Some suggestions of the outlook of power systems and wave energy converters in air-lift artificial upwelling application are also given. (C) 2015 Elsevier Ltd. All rights reserved.","Science \& Technology - Other Topics; Energy \& Fuels","2016.11745","selected",""
"Hawaii: The Center for Pacific Ocean Resources Technology (CPORT)","Takahashi, Patrick K. and Yuen, Paul C.","1991","Oceans (new York)","The Center for Pacific Ocean Resources Technology (CPORT) will develop the national exclusive economic zone (EEZ) resources--food, minerals, fresh water, energy and habitats--in an environmentally compatible manner. The first CPORT project will be in support to Blue Revolution 2000, a 100,000 square foot floating ocean resource applications platform. In years one to three the research focus will be placed on the use of artificial upwelling for open ocean mariculture, development of marine materials, and the design of the floating test bed. Actual construction will not occur until year five, and full operations are planned for the year 2000.",NA,"1991.3193","selected",""
"An open ocean trial of controlled upwelling using wave pump technology","White, A. and Björkman, K. and Grabowski, E. and Letelier, R. and Poulos, S. and Watkins, B. and Karl, D.","2010","Journal Of Atmospheric And Oceanic Technology","In 1976, John D. Isaacs proposed to use wave energy to invert the density structure of the ocean and pump deep, nutrient-rich water into the sunlit surface layers. The basic principle is simple: a length of tubing attached to a surface buoy at the top, and a one-way valve at the bottom can be extended below the euphotic zone to act as a conduit for deep water. The vertical motion of the ocean forces the attached valve to open on the downslope of a wave and close on the upslope, thus generating upward movement of deep water to the surface ocean. Although Isaacs's wave-powered pump has taken many forms, from energy production to aquaculture to the more recent suggestion that artificial upwelling could be used to stimulate primary productivity and carbon sequestration, the simple engineering concept remains the same. In June 2008, the authors tested a commercially available wave pump (Atmocean) north of Oahu, Hawaii, to assess the logistics of at-sea deployment and the durability of the equipment under open ocean conditions. This test was done as part of an experiment designed to evaluate a recently published hypothesis that upwelling of water containing excess phosphate (P) relative to nitrogen (N) compared to the canonical ""Redfield"" molar ratio of 16N:1P would generate a two-phased phytoplankton bloom. The end result of this field experiment was rapid delivery (&lt;2 h for a 300-m transit) of deep water to the surface ocean followed by catastrophic failure of pump materials under the dynamic stresses of the oceanic environment. Wave-driven upwelling of cold water was documented for a period of ~17 h, with a volumetric upwelling rate of ~45 m3 h-1 and an estimated total input of 765 m3 of nutrient-enriched deep water. The authors discuss the deployment of a 300-m wave pump, the strategy to sample a biogeochemical response, the engineering challenges faced, and the implications of these results for future experiments aimed at stimulating the growth of phytoplankton. © 2010 American Meteorological Society.",NA,"2010.1051","selected",""
"Ocean iron fertilization and international law","Freestone, David and Rayfuse, Rosemary","2008","Marine Ecology Progress Series","Intentional ocean fertilization and the commercial sale of associated carbon offsets raise a number of issues in international law. On the one hand, states are obliged to adopt adaptation and mitigation measures to prevent dangerous climate change. On the other hand, international law obliges states to protect and preserve the marine environment and to act in a precautionary manner in the face of scientific uncertainty. In this article, we examine the application of the international Law of the Sea to ocean fertilization, with particular reference to the law's dumping regime, which prohibits the dumping of wastes or other materials from vessels into the ocean. We then examine the application of the international legal regime on climate change to ocean fertilization and assess the international legal basis for the sale of carbon offsets or carbon credits associated with ocean fertilization. We conclude that ocean fertilization is governed by the dumping regime and that its commercialization is inconsistent with international law unless and until independent, internationally peer-reviewed scientific research and assessment demonstrates that it is effective and that its benefits outweigh the risks to the marine environment.","Environmental Sciences \& Ecology; Marine \& Freshwater Biology; Oceanography","2008.184","selected",""
"Artificial upwelling and near-field mixing of deep-ocean water effluent","Liu, C.C.K. and Sou, I.M. and Lin, H.","2003","Journal Of Marine Environmental Engineering","Deep-ocean water (DOW) at a depth of 300 m or lower is cold, nutrient-rich, and free of pathogenic bacteria. This water is considered an important natural resource. One of the fully developed technologies of DOW application is ocean thermal energy conversion (OTEC), which makes use of DOW for energy production. In recent years, the potential of DOW to enrich the open oceans and thus to increase fish yield has attracted the attention of researchers. Before this potential can be realized, however, major scientific and technological developments concerning artificial upwelling, plume mixing, and DOW stimulated bio-productivity must be achieved. This study, which is a continuation of earlier research on artificial upwelling at the University of Hawaii, investigates the effects of discharging artificially upwelled DOW into the open ocean where it is subsequently mixed with surface water. The study involves both hydraulic modeling and numerical simulation, and its objective is to control the near-field mixing of DOW effluent such that the dilution is small and the settling depth does not go below the euphotic zone. Special attention is given to wave effects on the near-field mixing processes. Research results indicate that, with proper effluent control, desirable nutrient-rich DOW plumes can be established and maintained in the open ocean.",NA,"2003.5402","selected",""
"How can stock enhancement and sea ranching help sustain and increase coastal fisheries?","Liao, IC","1999","NANA","In recent years stock enhancement and sea ranching have been recognized as two of the most essential strategies that can sustain and increase the resources of coastal fisheries. More than 100 species have been released in worldwide programmes. This chapter describes several important issues concerning stock enhancement and sea ranching. looking at both biological and non-biological aspects. Japan and Taiwan provide examples. and the most common problems in implement action are discussed. Finally. new concepts and strategies are suggested to improve overall efficiency and to increase primary productivity in ranching areas by artificial upwelling and fertilization. Future stock enhancement and sea ranching should take place within holistic fisheries management. The benefits are not only to the oceanic resources but also to human beings in general. and so we should take a global view in developing stock enhancement and sea ranching programmes.","Fisheries","1999.2323","excluded",""
"Climate change, ocean processes and ocean iron fertilization","Denman, Kenneth L.","2008","Marine Ecology Progress Series","Observations indicate that the rate of increase in concentration of atmospheric CO2 is increasing faster than projected in any of the Intergovernmental Panel on Climate Change (IPCC) emission scenarios. Several mitigation measures, referred to as `geoengineering options', have been proposed to remove CO2 from the atmosphere. To be successful, such a mitigation operation must remove `significant' CO2 from the atmosphere for many decades, be verifiable, and not cause deleterious side effects. One option, purposeful addition of iron to fertilize photosynthetic uptake Of CO2 by phytoplankton in regions of the ocean where iron is a limiting nutrient, has received considerable scientific attention. In the last 15 yr, a dozen small-scale open ocean iron fertilization experiments have been performed and a succession of models of large-scale fertilization have been developed. As successive models have become more realistic, the amounts Of CO2 forecast to be sequestered have dropped, and in all cases are small relative to the amounts Of CO2 projected to be released through fossil fuel burning over the next century for any of the IPCC emission scenarios. Possible side effects include a long term reduction in ocean productivity, alteration of the structure of marine food webs, and a more rapid increase in ocean acidity. Most importantly, increased remineralization associated with the increased downward export of organic carbon particles would result: in increased production of the third most important long-lived greenhouse gas, N2O. The magnitude of this effect is poorly known.","Environmental Sciences \& Ecology; Marine \& Freshwater Biology; Oceanography","2008.385","selected",""
